[
    {
        "typeName": "TypeA",
        "description": "Test type A",
        "moduleName": "./test-app",
        "functionName": "types.createA",
        "exampleObjects": [
            {
                "_type": "TypeA",
                "value": 1
            }
        ]
    },
    {
        "typeName": "TypeB",
        "description": "Test type B",
        "moduleName": "./test-app",
        "functionName": "types.createB_app",
        "exampleObjects": [
            {
                "_type": "TypeB",
                "value": "abc"
            }
        ]
    },
    {
        "typeName": "TypeC",
        "description": "Test type C",
        "moduleName": "./test-app",
        "functionName": "types.createC_app",
        "exampleObjects": [
            {
                "_type": "TypeC",
                "value": "abc"
            }
        ]
    }
]